{
  "$schema": "https://json-schema.org/draft/2020-12/schema",
  "$id": "https://animation-studio.local/schemas/rig.schema.json",
  "title": "Character rig",
  "description": "A cut-out puppet: PNG parts carried by a bone hierarchy (D-027), per view. Lives at films/<film>/characters/<id>/rig.json. All positions are pixels in a part's own image (origin top-left, y down). The rest pose is the art as drawn: each bone points in its `direction_deg`, and motion angles are offsets from that rest pose. Structural rules JSON Schema cannot express (one root, no cycles, joints attach to the parent's part, draw order lists every part once) are checked by studio_core.schema.check_rig.",
  "type": "object",
  "required": [
    "schema_version",
    "id",
    "name",
    "default_view",
    "views"
  ],
  "additionalProperties": false,
  "properties": {
    "schema_version": {
      "const": 1
    },
    "id": {
      "$ref": "#/$defs/id",
      "description": "Character id, e.g. 'pip'."
    },
    "name": {
      "type": "string",
      "minLength": 1,
      "maxLength": 60,
      "description": "Display name, e.g. 'Pip'."
    },
    "style": {
      "type": "string",
      "description": "Style preset the art was made with (config/models.toml [styles], D-025)."
    },
    "default_view": {
      "$ref": "#/$defs/view_name"
    },
    "views": {
      "type": "object",
      "description": "One rig per view. Front is required for v1; three_quarter is optional.",
      "propertyNames": {
        "$ref": "#/$defs/view_name"
      },
      "required": [
        "front"
      ],
      "additionalProperties": {
        "$ref": "#/$defs/view"
      }
    }
  },
  "$defs": {
    "id": {
      "type": "string",
      "pattern": "^[a-z][a-z0-9_]{0,39}$",
      "description": "Lowercase identifier: letters, digits, underscores; starts with a letter."
    },
    "view_name": {
      "enum": [
        "front",
        "three_quarter"
      ]
    },
    "point_px": {
      "type": "array",
      "description": "[x, y] in image pixels, origin top-left, y down.",
      "prefixItems": [
        {
          "type": "number"
        },
        {
          "type": "number"
        }
      ],
      "items": false,
      "minItems": 2
    },
    "size_px": {
      "type": "array",
      "description": "[width, height] in pixels.",
      "prefixItems": [
        {
          "type": "integer",
          "minimum": 1
        },
        {
          "type": "integer",
          "minimum": 1
        }
      ],
      "items": false,
      "minItems": 2
    },
    "color": {
      "type": "string",
      "pattern": "^#[0-9a-fA-F]{6}$"
    },
    "view": {
      "type": "object",
      "required": [
        "root",
        "bones",
        "parts",
        "draw_order"
      ],
      "additionalProperties": false,
      "properties": {
        "root": {
          "$ref": "#/$defs/id",
          "description": "Name of the root bone (usually the hips/torso). Its pivot is where the character stands."
        },
        "bones": {
          "type": "object",
          "minProperties": 1,
          "propertyNames": {
            "$ref": "#/$defs/id"
          },
          "additionalProperties": {
            "$ref": "#/$defs/bone"
          }
        },
        "parts": {
          "type": "object",
          "minProperties": 1,
          "propertyNames": {
            "$ref": "#/$defs/id"
          },
          "additionalProperties": {
            "$ref": "#/$defs/part"
          }
        },
        "draw_order": {
          "type": "array",
          "description": "Part names from back to front. Independent of the bone hierarchy (a far arm can sit behind the torso).",
          "items": {
            "$ref": "#/$defs/id"
          },
          "uniqueItems": true,
          "minItems": 1
        },
        "face": {
          "$ref": "#/$defs/face"
        },
        "hands": {
          "type": "object",
          "description": "Swappable hand poses, keyed by the forearm bone the hand hangs on. Optional: a view without it keeps the hand as cut (the end of the forearm image) at all times. A drawn pose is a vector hand in the character's colours, switched over time like a mouth shape.",
          "minProperties": 1,
          "propertyNames": { "$ref": "#/$defs/id" },
          "additionalProperties": { "$ref": "#/$defs/hand" }
        },
        "bendable_limbs": {
          "type": "array",
          "description": "Limbs that are drawn as ONE image and bend smoothly at the joint (arms, legs), instead of two rigid parts. Optional: a view without it is the plain two-part rig. Each limb replaces every part carried by its two bones: when the engine bends limbs, those parts are not drawn and the limb image is drawn in the earliest draw_order slot of them. The parts stay in the rig as the fallback (two rigid pieces, used when bending is switched off) and because a child joint (a hand) attaches to a part of its parent bone.",
          "items": {
            "$ref": "#/$defs/bendable_limb"
          }
        }
      }
    },
    "bone": {
      "type": "object",
      "required": [
        "parent",
        "direction_deg"
      ],
      "additionalProperties": false,
      "properties": {
        "parent": {
          "description": "Parent bone name, or null for the root bone.",
          "oneOf": [
            {
              "type": "null"
            },
            {
              "$ref": "#/$defs/id"
            }
          ]
        },
        "attach": {
          "type": "object",
          "description": "Where this bone's joint sits: a pixel in one of the parent bone's part images. Omitted for the root.",
          "required": [
            "part",
            "at_px"
          ],
          "additionalProperties": false,
          "properties": {
            "part": {
              "$ref": "#/$defs/id"
            },
            "at_px": {
              "$ref": "#/$defs/point_px"
            }
          }
        },
        "direction_deg": {
          "type": "number",
          "minimum": -180,
          "maximum": 180,
          "description": "Rest direction of the bone in the drawn art, degrees counter-clockwise from +x: 90 = up (torso, head), -90 = down (hanging arms, legs)."
        },
        "length_px": {
          "type": "number",
          "exclusiveMinimum": 0,
          "description": "Visible bone length, for drawing handles only."
        },
        "side": {
          "enum": [
            "left",
            "right",
            "center"
          ],
          "description": "The character's own left/right, for motions with a `side` parameter."
        },
        "limits_deg": {
          "type": "object",
          "description": "Allowed offset from the rest pose; motions and pose_at clamp to it.",
          "required": [
            "min",
            "max"
          ],
          "additionalProperties": false,
          "properties": {
            "min": {
              "type": "number",
              "minimum": -360,
              "maximum": 0
            },
            "max": {
              "type": "number",
              "minimum": 0,
              "maximum": 360
            }
          }
        },
        "follow": {
          "type": "object",
          "description": "Optional tuning of the follow-through layer for a secondary bone (role `ear` or `tail`): the layer lags the bone behind its parent and lets it overshoot a little (studio_core.motions.follow). Every field is optional; the layer has defaults per role and scales them by the action's energy. Rigs without ear or tail bones never use it.",
          "additionalProperties": false,
          "properties": {
            "lag_s": {
              "type": "number",
              "exclusiveMinimum": 0,
              "maximum": 1,
              "description": "How long the bone trails its parent's turn, in seconds."
            },
            "damping": {
              "type": "number",
              "exclusiveMinimum": 0,
              "maximum": 1.5,
              "description": "0.2 swings several times, 0.5 overshoots a little, 1 does not overshoot."
            },
            "gain": {
              "type": "number",
              "minimum": 0,
              "maximum": 2,
              "description": "Scales the whole response; 0 switches follow-through off for this bone."
            }
          }
        },
        "role": {
          "enum": [
            "torso",
            "head",
            "upper_arm",
            "forearm",
            "hand",
            "thigh",
            "shin",
            "foot",
            "tail",
            "ear",
            "other"
          ],
          "description": "What the bone is, so named motions (wave, walk, nod...) can find it on any rig. Combined with `side` for limbs."
        }
      }
    },
    "part": {
      "type": "object",
      "required": [
        "file",
        "size_px",
        "pivot_px",
        "bone"
      ],
      "additionalProperties": false,
      "properties": {
        "file": {
          "type": "string",
          "pattern": "^[A-Za-z0-9_][A-Za-z0-9_./-]*\\.png$",
          "description": "PNG path relative to the character folder, e.g. 'parts/torso.png'."
        },
        "size_px": {
          "$ref": "#/$defs/size_px"
        },
        "pivot_px": {
          "$ref": "#/$defs/point_px",
          "description": "The pixel that sits on the bone's joint (it rotates around this point)."
        },
        "bone": {
          "$ref": "#/$defs/id",
          "description": "The bone that carries this part."
        }
      }
    },
    "face": {
      "type": "object",
      "description": "Anchors for the procedural vector face (D-007), in pixels of `part` (the head image).",
      "required": [
        "part",
        "eyes",
        "mouth"
      ],
      "additionalProperties": false,
      "properties": {
        "part": {
          "$ref": "#/$defs/id"
        },
        "eyes": {
          "type": "object",
          "required": [
            "left_px",
            "right_px",
            "size_px"
          ],
          "additionalProperties": false,
          "properties": {
            "left_px": {
              "$ref": "#/$defs/point_px",
              "description": "Centre of the character's left eye (on the viewer's right in the front view)."
            },
            "right_px": {
              "$ref": "#/$defs/point_px"
            },
            "size_px": {
              "type": "number",
              "exclusiveMinimum": 0,
              "description": "Eye height."
            }
          }
        },
        "brows": {
          "type": "object",
          "required": [
            "left_px",
            "right_px",
            "width_px"
          ],
          "additionalProperties": false,
          "properties": {
            "left_px": {
              "$ref": "#/$defs/point_px"
            },
            "right_px": {
              "$ref": "#/$defs/point_px"
            },
            "width_px": {
              "type": "number",
              "exclusiveMinimum": 0
            }
          }
        },
        "mouth": {
          "type": "object",
          "required": [
            "at_px",
            "width_px"
          ],
          "additionalProperties": false,
          "properties": {
            "at_px": {
              "$ref": "#/$defs/point_px"
            },
            "width_px": {
              "type": "number",
              "exclusiveMinimum": 0
            }
          }
        },
        "colors": {
          "type": "object",
          "additionalProperties": false,
          "properties": {
            "line": {
              "$ref": "#/$defs/color"
            },
            "eye_white": {
              "$ref": "#/$defs/color"
            },
            "iris": {
              "$ref": "#/$defs/color"
            },
            "mouth": {
              "$ref": "#/$defs/color"
            },
            "tongue": {
              "$ref": "#/$defs/color"
            }
          }
        }
      }
    },
    "hand": {
      "type": "object",
      "description": "The hand at the end of one forearm: where the wrist is, how big the hand is, which poses exist and the colours the drawn poses use. `rest` is the hand as cut (nothing is drawn over it); any other pose is drawn in code over the end of the forearm image, pointing along the forearm's bone direction.",
      "required": ["part", "wrist_px", "size_px", "poses", "fill"],
      "additionalProperties": false,
      "properties": {
        "part": { "$ref": "#/$defs/id", "description": "The part (the forearm image) the hand is drawn with; it must be carried by this forearm bone." },
        "wrist_px": { "$ref": "#/$defs/point_px", "description": "The wrist in pixels of `part`: where the drawn hand starts." },
        "size_px": { "type": "number", "exclusiveMinimum": 0, "description": "Width of the hand across the wrist, in pixels: taken from the cut hand so a drawn hand matches the character." },
        "poses": {
          "type": "array",
          "description": "Which hand poses this hand has. `rest` is required.",
          "items": { "enum": ["rest", "fist", "point", "open", "wave"] },
          "uniqueItems": true,
          "minItems": 1
        },
        "fill": { "$ref": "#/$defs/color", "description": "Fill colour of a drawn hand (the cut hand's own colour)." },
        "outline": { "$ref": "#/$defs/color", "description": "Outline colour of a drawn hand. Defaults to the face's `line` colour." },
        "cover_px": { "type": "array", "minItems": 3, "items": { "$ref": "#/$defs/point_px" }, "description": "The cut hand's outline in pixels of `part` (a convex polygon around every pixel of the hand beyond the wrist). Every drawn pose is drawn on a backing of this shape in the hand's colours, so no part of the cut hand shows beside a narrower pose. Optional: without it a pose can show the cut hand's edge." }
      }
    },
    "bendable_limb": {
      "type": "object",
      "description": "One limb image bent along a two-bone chain. The image is the limb drawn straight in the rest pose (as the parts are drawn).",
      "required": [
        "name",
        "bones",
        "file",
        "size_px",
        "pivot_px",
        "joint_px"
      ],
      "additionalProperties": false,
      "properties": {
        "name": {
          "$ref": "#/$defs/id",
          "description": "Limb name, unique in the view, e.g. 'arm_l'."
        },
        "bones": {
          "type": "array",
          "description": "[upper bone, lower bone]: the lower bone's parent is the upper bone, e.g. ['upper_arm_l', 'forearm_l'].",
          "prefixItems": [
            {
              "$ref": "#/$defs/id"
            },
            {
              "$ref": "#/$defs/id"
            }
          ],
          "items": false,
          "minItems": 2
        },
        "file": {
          "type": "string",
          "pattern": "^[A-Za-z0-9_][A-Za-z0-9_./-]*\\.png$",
          "description": "PNG path relative to the character folder, e.g. 'parts/arm_l.png'."
        },
        "size_px": {
          "$ref": "#/$defs/size_px"
        },
        "pivot_px": {
          "$ref": "#/$defs/point_px",
          "description": "The pixel that sits on the first (upper) bone's joint, e.g. the shoulder."
        },
        "joint_px": {
          "$ref": "#/$defs/point_px",
          "description": "The pixel on the second joint (the elbow or knee), where the limb bends. Its offset from pivot_px must match the lower bone's `attach` offset in the rig (within a few pixels)."
        }
      }
    }
  }
}
